	ids	company	slogan	logo	member	calender	ot	country	typeCompany	agency	overview	why_you_work_here	key_skill	description	address
49	49	Viet Thai International	Viet Thai International Joint Stock Company	https://itviec.com/rails/active_storage/representations/proxy/eyJfcmFpbHMiOnsibWVzc2FnZSI6IkJBaHBBeG5uSWc9PSIsImV4cCI6bnVsbCwicHVyIjoiYmxvYl9pZCJ9fQ==--68eaf7e867637bcec34c183ec8b466b2643d69ea/eyJfcmFpbHMiOnsibWVzc2FnZSI6IkJBaDdCem9MWm05eWJXRjBTU0lJYW5CbkJqb0dSVlE2RTNKbGMybDZaVjloYm1SZmNHRmtXd2RwUm1sRyIsImV4cCI6bnVsbCwicHVyIjoidmFyaWF0aW9uIn19--e48ed52d99e56a5ff9747052d860ea1b318b2d76/188723969_1691898234531178_5641066695998109400_n.jpg	301-500	Monday - Friday	No OT	Vietnam	Product		['Viet Thai International provides a dynamic and challenging work environment with tremendous opportunities for professional as well as personal growth. Viet Thai International JSC (VTI) was established in 1998 and today has grown into one of the largest consumer marketing and multi-unit retail operators in Vietnam. The Company’s vision is to play a significant part in improving the quality of life for Vietnam’s rising middle class. Over the past decade, VTI has been instrumental in shaping the country’s modern retail and branding environment. This is through a portfolio of Company-owned brands such as Highlands Coffee, Pho 24. Additionally, VTI represents leading international brands including Hard Rock Cafe, Swarovski, ALDO Shoes & Accessories.', 'We are always looking for great people to join our ranks.']	[]	['System Engineer', 'Team Leader', 'Manager']	['Health care, dental insurance.', '12 paid leave days a year.', 'Phone and gas allowance.', 'Good discounts at Highlands Shops and Pho24 shops, with additional Customer & Lifestyle promotions.', 'Prime location in Sala.', 'Sponsored Events (Women’s Day, Men’s Day, Halloween party, Christmas party, Year-end party, and more).']	['Khu đô thị Sala, 119 - 127 Nguyen Co Thach\nThu Duc City\nHo Chi Minh']
50	50	DIAG	DIAG	https://itviec.com/rails/active_storage/representations/proxy/eyJfcmFpbHMiOnsibWVzc2FnZSI6IkJBaHBBK29wRXc9PSIsImV4cCI6bnVsbCwicHVyIjoiYmxvYl9pZCJ9fQ==--606daed0a3fd4ab23cb579690242c1f75c6d0921/eyJfcmFpbHMiOnsibWVzc2FnZSI6IkJBaDdCem9MWm05eWJXRjBTU0lJY0c1bkJqb0dSVlE2RTNKbGMybDZaVjloYm1SZmNHRmtXd2RwUm1sRyIsImV4cCI6bnVsbCwicHVyIjoidmFyaWF0aW9uIn19--d55b6722f71e82d147ad94b8445be27797820f9f/t%E1%BA%A3i%20xu%E1%BB%91ng.png	301-500	Monday - Friday	No OT	United States	Product		['Diag is a leading diagnostic laboratory that empowers Vietnam’s doctors, clinics, hospitals, and corporate wellness programs. As Vietnam’s oldest foreign founded laboratory, Diag was established in 1998 by French biologists with a mission to enhance laboratory testing for the Vietnamese people. We remain committed to this vision today. Our goal is to advance laboratory diagnostics and improve healthcare technology.']	['1\nCompetitive compensation.', '2\nYoung and International environment', '3\nFlexibility to work from home']	['UI-UX', 'Android', 'iOS', 'Swift', 'Kotlin']	['Competitive compensation.', 'Flexibility to work from home.', 'Health perks.', 'Meal allowance.', 'Young and International environment.']	['414-416-418-420 Cao Thang Street, Ward 12\nDistrict 10\nHo Chi Minh']
51	51	Enlab Software	The lab for your digital transformation	https://itviec.com/rails/active_storage/representations/proxy/eyJfcmFpbHMiOnsibWVzc2FnZSI6IkJBaHBBMmZtR2c9PSIsImV4cCI6bnVsbCwicHVyIjoiYmxvYl9pZCJ9fQ==--5d383e55d4f0b83cd2c28fa224cfddbd7bfc83b3/eyJfcmFpbHMiOnsibWVzc2FnZSI6IkJBaDdCem9MWm05eWJXRjBTU0lJY0c1bkJqb0dSVlE2RTNKbGMybDZaVjloYm1SZmNHRmtXd2RwUm1sRyIsImV4cCI6bnVsbCwicHVyIjoidmFyaWF0aW9uIn19--d55b6722f71e82d147ad94b8445be27797820f9f/Enlab_Primary-Logo_Horizontal_On-Light@2x.png	51-150	Monday - Friday	No OT	Vietnam	Product		['Overview about Enlab Software', 'THE LAB FOR DIGITAL TRANSFORMATION', 'Enlab Software is a dedicated offshore software development company, providing enterprise application with top-notch quality in every Agile delivery. With complete transparency and integrity.', 'FARM THE FUTURE. ONWARD AND UPWARD.', 'At Enlab, we strive to build a company where amazing people like you could do your best work, inspired by professional but warm colleagues. It’s where you could foster your professional growth and build a healthy personal life. In the end, we create a life-long relationship where Humanity, Integrity and Excellence are valued.']	['1\nOpen, friendly work environment with flexible time', '2\nExclusive technical & soft skills training course', '3\n6-month review, 13th month and performance bonus']	['ASP.NET', '.NET', 'Angular', 'Python', 'AWS', 'VueJS']	"['The definition of great workplace', ""For many of us, a great workplace could be beautiful offices, premium benefits, grand parties. Of course, it should be included but not limited. At Enlab, we strive to build a company where amazing people like you could do your best work, inspired by professional but warm colleagues. It's where you could foster your professional growth and build a healthy personal life. In the end, we create a life-long relationship."", 'Flexible timings', 'Your working hours work on your own schedule. In the end, the result only matters.', 'Green and bright office', 'We built an office building that is surrounded by trees, lights, and fantastic views. We’ve got a collaborative lounge and ample breakout spaces for an efficient workflow.', 'Healthy working lifestyle', 'We prepare spacious cafeterias with healthy snacks and cooking machines for your happy belly. And yeah, some excellent coffees to make your day. And of course, some fitness tools to strengthen your muscles.', 'Door to peace and mindfulness', 'How about your mind and soul? We reserve one space in our office for practicing meditation. We believe this practice could help you to release stress, find calm back to your soul, and enjoy the mindfulness status.', '“Learn-it-all"" culture', 'We find the niches between project deadlines for providing mentor guides and seminars to train you. Take advantage to polish your skills and knowledge. We create an environment for a continuous-learning mindset. And we hope you share this mindset to grow better together.', 'Last but not least, merit money', 'Pay rise, promotions, and top opportunities will come along with your professional development. Periodically.']"	['27 Che Viet Tan, Hoa Xuan\nCam Le\nDa Nang', 'REMOTE\nDistrict 1\nHo Chi Minh']
52	52	DEK Technologies	An Australian outsourcing design company with experience in all aspects of project life cycle	https://itviec.com/rails/active_storage/representations/proxy/eyJfcmFpbHMiOnsibWVzc2FnZSI6IkJBaHBBOUFuREE9PSIsImV4cCI6bnVsbCwicHVyIjoiYmxvYl9pZCJ9fQ==--4f2e6d9f3a3f8fd68828c39ac6b14b8ea961c55e/eyJfcmFpbHMiOnsibWVzc2FnZSI6IkJBaDdCem9MWm05eWJXRjBTU0lJY0c1bkJqb0dSVlE2RTNKbGMybDZaVjloYm1SZmNHRmtXd2RwUm1sRyIsImV4cCI6bnVsbCwicHVyIjoidmFyaWF0aW9uIn19--d55b6722f71e82d147ad94b8445be27797820f9f/dek-technologies-logo.png	301-500	Monday - Friday	No OT	Australia	Outsourcing		"[""DEK Technologies is a professional organization that places high value on people and the individual competence that they contribute. People enjoy working at DEK. They enjoy the team camaraderie, flexibility, opportunities for travel, and feeling part of the company's success."", 'Come and be proud to be an integral part of helping our international customers develop the latest products that are sold globally and used by millions of people around the world.', 'With offices situated in Melbourne Australia, Stockholm Sweden, Rome Italy, and Ho Chi Minh City Vietnam, you too can be a key part of our success.']"	['1\n100% salary during probation, 13th salary', '2\nPremium insurance (includes probation time)', '3\nTechnical, Soft skill, English Training courses']	['Linux', 'C++', 'C language', 'JavaScript', 'Networking']	['At DEK Technologies you will find yourself in an exciting career with:', '  Attractive, competitive salary and incentives', 'Opportunities for short and long-term training/work overseas', 'An excellent working environment in developing tomorrow’s features', 'Open and honest culture where people are valued, treated fairly, trusted and empowered', 'Training and career development opportunities', '40 flexible working hours per week from Monday to Friday', 'English classes 3 hours a week with qualified foreign teachers', 'Extra 24/7 Health and Accident Insurance', 'Annual health check up', 'Annual company trip', 'Annual family day', 'Sport clubs', 'Music club', 'Yoga club', 'Piano club']	['121 Le Loi\nDistrict 1\nHo Chi Minh']
53	53	MSB	Ngay từ khi thành lập, MSB đã ghi dấu ấn trong ngành Ngân hàng khi tiên phong ứng dụng Công nghệ.	https://itviec.com/rails/active_storage/representations/proxy/eyJfcmFpbHMiOnsibWVzc2FnZSI6IkJBaHBBNy9yRVE9PSIsImV4cCI6bnVsbCwicHVyIjoiYmxvYl9pZCJ9fQ==--d034e16b07497fae6b78f009f7a9a5a3835bf886/eyJfcmFpbHMiOnsibWVzc2FnZSI6IkJBaDdCem9MWm05eWJXRjBTU0lJYW5CbkJqb0dSVlE2RTNKbGMybDZaVjloYm1SZmNHRmtXd2RwUm1sRyIsImV4cCI6bnVsbCwicHVyIjoidmFyaWF0aW9uIn19--e48ed52d99e56a5ff9747052d860ea1b318b2d76/JPG%20co%CC%81%20te%CC%82n%20%C4%91a%CC%82%CC%80y%20%C4%91u%CC%89.jpg	1000+	Monday - Friday	No OT	Vietnam	Product		['Trải qua 30 năm hình thành & phát triển, MSB không ngừng tạo lập nhiều cột mốc mang tính đột phá trong ngành TCNH:', '2021, 02 siêu dự án: Digital Factory (DF); Core Banking và nhiều dự án Công nghệ khác thuộc Khối Công nghệ của MSB đã tạo nên một Tổ hợp Công nghệ lớn (MSB Digital Innovation). Tổ hợp này có nhiệm vụ mang tính chiến lược, định hình hoạt động của MSB trong thời gian 10-15 năm tới. Tính đến 2020, MSB đã đưa vào sử dụng gần 230 ứng dụng cùng nhiều công nghệ mới hiện đại (Cloud, Machine Learning, AI, Low code, vv…).', '2019, MSB triển khai thay đổi toàn diện từ nhận diện thương hiệu đến mô hình trải nghiệm để trở thành ngân hàng đáng tin cậy, thấu hiểu khách hàng nhất & đạt lợi nhuận cao tại VN.', '2018, MSB tiếp tục tiên phong trong việc ứng dụng công nghệ 4.0 & trở thành ngân hàng đầu tiên ứng dụng trí tuệ nhân tạo (AI) vào phát hành thẻ tín dụng & tích hợp thành công phương thức thanh toán QR code với 2 đối tác lớn là Vnpay & Payoo.', '2015, MSB trở thành 1 trong những ngân hàng TMCP hàng đầu VN về vốn điều lệ & mạng lưới khi sáp nhập ngân hàng TMCP Phát Triển Mê Kông & mua lại công ty Tài Chính Cổ Phần Dệt May VN.', 'Từ 2009 - 2010, MSB xây dựng chiến lược kinh doanh lâu dài/quy mô với sự tư vấn của tổ chức Quốc tế McKinsey ', 'Với các chính sách thu hút và coi trọng hiền tài, MSB mong sẽ được đồng hành cùng bạn để tiếp tục thiết lập những dấu ấn công nghệ, giúp bạn tỏa sáng và tạo nên sự bứt phá mới cho Ngân hàng']	['1\nSiêu dự án hàng chục triệu đô (Product)', '2\nGói thu nhập lên đến 18 tháng lương + thưởng dự án', '3\nLàm việc với Chuyên gia hàng đầu BCG, AWS, IBM…']	['Python', 'SQL', 'Java', 'Agile', 'AWS', 'Cloud']	['Tham gia những siêu dự án với vốn đầu tư 2000 tỉ đồng, ứng dụng những công nghệ mới nhất.', 'Được dẫn dắt bởi đội ngũ quản lý giỏi chuyên môn, đánh giá công bằng. Cơ hội làm việc trực tiếp với các đối tác hàng đầu thế giới (AWS; BCG; IBM; Temenos…).', 'Gói thu nhập từ 15 đến 18 tháng lương/năm (có thưởng dự án tùy vị trí công việc). Nhận mức offer cạnh tranh nếu có năng lực vượt trội.', 'Được vay vốn ngân hàng lãi suất thấp, mua cổ phiếu giá ưu đãi theo chương trình dành cho người nội bộ. Kèm thêm gói Bảo hiểm sức khỏe cao cấp - MSB care.', 'Nhiều chương trình đào tạo nâng cao kỹ năng, năng lực chuyên môn. Được tham gia chương trình Lãnh đạo kế cận (Talent Pool) khi nhiều năm có hiệu suất năm việc tốt.', 'Cơ sở vật chất, công cụ lao động tốt, cấu hình mạnh mẽ. Làm việc tại tòa nhà hạng A theo mô hình Agile.']	['Tòa nhà TNR, 54A Nguyễn Chí Thanh\nDong Da\nHa Noi', 'Tòa nhà TNR, số 180 - 192 Nguyễn Công Trứ, Phường Nguyễn Thái Bình\nDistrict 1\nHo Chi Minh']
54	54	MSB	Ngay từ khi thành lập, MSB đã ghi dấu ấn trong ngành Ngân hàng khi tiên phong ứng dụng Công nghệ.	https://itviec.com/rails/active_storage/representations/proxy/eyJfcmFpbHMiOnsibWVzc2FnZSI6IkJBaHBBNy9yRVE9PSIsImV4cCI6bnVsbCwicHVyIjoiYmxvYl9pZCJ9fQ==--d034e16b07497fae6b78f009f7a9a5a3835bf886/eyJfcmFpbHMiOnsibWVzc2FnZSI6IkJBaDdCem9MWm05eWJXRjBTU0lJYW5CbkJqb0dSVlE2RTNKbGMybDZaVjloYm1SZmNHRmtXd2RwUm1sRyIsImV4cCI6bnVsbCwicHVyIjoidmFyaWF0aW9uIn19--e48ed52d99e56a5ff9747052d860ea1b318b2d76/JPG%20co%CC%81%20te%CC%82n%20%C4%91a%CC%82%CC%80y%20%C4%91u%CC%89.jpg	1000+	Monday - Friday	No OT	Vietnam	Product		['Trải qua 30 năm hình thành & phát triển, MSB không ngừng tạo lập nhiều cột mốc mang tính đột phá trong ngành TCNH:', '2021, 02 siêu dự án: Digital Factory (DF); Core Banking và nhiều dự án Công nghệ khác thuộc Khối Công nghệ của MSB đã tạo nên một Tổ hợp Công nghệ lớn (MSB Digital Innovation). Tổ hợp này có nhiệm vụ mang tính chiến lược, định hình hoạt động của MSB trong thời gian 10-15 năm tới. Tính đến 2020, MSB đã đưa vào sử dụng gần 230 ứng dụng cùng nhiều công nghệ mới hiện đại (Cloud, Machine Learning, AI, Low code, vv…).', '2019, MSB triển khai thay đổi toàn diện từ nhận diện thương hiệu đến mô hình trải nghiệm để trở thành ngân hàng đáng tin cậy, thấu hiểu khách hàng nhất & đạt lợi nhuận cao tại VN.', '2018, MSB tiếp tục tiên phong trong việc ứng dụng công nghệ 4.0 & trở thành ngân hàng đầu tiên ứng dụng trí tuệ nhân tạo (AI) vào phát hành thẻ tín dụng & tích hợp thành công phương thức thanh toán QR code với 2 đối tác lớn là Vnpay & Payoo.', '2015, MSB trở thành 1 trong những ngân hàng TMCP hàng đầu VN về vốn điều lệ & mạng lưới khi sáp nhập ngân hàng TMCP Phát Triển Mê Kông & mua lại công ty Tài Chính Cổ Phần Dệt May VN.', 'Từ 2009 - 2010, MSB xây dựng chiến lược kinh doanh lâu dài/quy mô với sự tư vấn của tổ chức Quốc tế McKinsey ', 'Với các chính sách thu hút và coi trọng hiền tài, MSB mong sẽ được đồng hành cùng bạn để tiếp tục thiết lập những dấu ấn công nghệ, giúp bạn tỏa sáng và tạo nên sự bứt phá mới cho Ngân hàng']	['1\nSiêu dự án hàng chục triệu đô (Product)', '2\nGói thu nhập lên đến 18 tháng lương + thưởng dự án', '3\nLàm việc với Chuyên gia hàng đầu BCG, AWS, IBM…']	['Python', 'SQL', 'Java', 'Agile', 'AWS', 'Cloud']	['Tham gia những siêu dự án với vốn đầu tư 2000 tỉ đồng, ứng dụng những công nghệ mới nhất.', 'Được dẫn dắt bởi đội ngũ quản lý giỏi chuyên môn, đánh giá công bằng. Cơ hội làm việc trực tiếp với các đối tác hàng đầu thế giới (AWS; BCG; IBM; Temenos…).', 'Gói thu nhập từ 15 đến 18 tháng lương/năm (có thưởng dự án tùy vị trí công việc). Nhận mức offer cạnh tranh nếu có năng lực vượt trội.', 'Được vay vốn ngân hàng lãi suất thấp, mua cổ phiếu giá ưu đãi theo chương trình dành cho người nội bộ. Kèm thêm gói Bảo hiểm sức khỏe cao cấp - MSB care.', 'Nhiều chương trình đào tạo nâng cao kỹ năng, năng lực chuyên môn. Được tham gia chương trình Lãnh đạo kế cận (Talent Pool) khi nhiều năm có hiệu suất năm việc tốt.', 'Cơ sở vật chất, công cụ lao động tốt, cấu hình mạnh mẽ. Làm việc tại tòa nhà hạng A theo mô hình Agile.']	['Tòa nhà TNR, 54A Nguyễn Chí Thanh\nDong Da\nHa Noi', 'Tòa nhà TNR, số 180 - 192 Nguyễn Công Trứ, Phường Nguyễn Thái Bình\nDistrict 1\nHo Chi Minh']
55	55	Quantic	Quantic is a leading offshore software outsourcing company in Vietnam to overseas market	https://itviec.com/rails/active_storage/representations/proxy/eyJfcmFpbHMiOnsibWVzc2FnZSI6IkJBaHBBK2duREE9PSIsImV4cCI6bnVsbCwicHVyIjoiYmxvYl9pZCJ9fQ==--c58262198223ff77b3a31a4d33fe8600839c86c6/eyJfcmFpbHMiOnsibWVzc2FnZSI6IkJBaDdCem9MWm05eWJXRjBTU0lJYW5CbkJqb0dSVlE2RTNKbGMybDZaVjloYm1SZmNHRmtXd2RwUm1sRyIsImV4cCI6bnVsbCwicHVyIjoidmFyaWF0aW9uIn19--e48ed52d99e56a5ff9747052d860ea1b318b2d76/quantic-logo.jpg	51-150	Monday - Friday	No OT	Vietnam	Outsourcing		"['Quantic is a leading company in Vietnam which specializes in providing software development service to overseas market. Our customers are from North America, Europe, Japan. We are one of the pioneering IT companies in Vietnam, was estabished in 1991 and currently has more than 70 software designers', '', 'Our mission is to give our customers the best value through excellent service with the cutting-edge technologies and low cost at any and every time. We have built a strong technical and management team that can handle large and complex international projects. Our people were selected from top Universities in Vietnam and 40% of them have chance onsite overseas (US and Japan).', '', ""If you want to work with the big international clients and promote your career, let's join us now!""]"	['1\nThe leading IT companies in Vietnam', '2\nGood working environment with modern office', '3\nOppotunity to onsite']	['Java', 'PHP', 'Tester', 'JavaScript', 'QA QC', '.NET']	['Successful candidates will have the following benefits:', '- Competitive salary', '- Continuous development of technical and soft skills through commercial work and formal trainings', '- Good working environment and friendly, supportive colleagues']	['176/4 Le Van Sy Street, 10 Ward\nPhu Nhuan\nHo Chi Minh']
56	56	PIXA STUDIO Co., Ltd	"""Whatever you do, work at it with all your heart, as working for the Lord, not for human masters"""	https://itviec.com/rails/active_storage/representations/proxy/eyJfcmFpbHMiOnsibWVzc2FnZSI6IkJBaHBBOGh5R2c9PSIsImV4cCI6bnVsbCwicHVyIjoiYmxvYl9pZCJ9fQ==--757f71a8c8f11e04e525b19042412f833536c5f7/eyJfcmFpbHMiOnsibWVzc2FnZSI6IkJBaDdCem9MWm05eWJXRjBTU0lJY0c1bkJqb0dSVlE2RTNKbGMybDZaVjloYm1SZmNHRmtXd2RwUm1sRyIsImV4cCI6bnVsbCwicHVyIjoidmFyaWF0aW9uIn19--d55b6722f71e82d147ad94b8445be27797820f9f/123398509_908555426342760_222799588355932358_n.png	1-50	Monday - Friday	No OT	Vietnam	Outsourcing		['PIXA STUDIO Co., Ltd, a mobile outsourcing company in Ho Chi Minh city, Viet Nam, established in early 2015, is a professional, creative, and reliable. We focus on mobile apps outsourcing, especially for well-known mobile platforms such as Android, iOS. The main technology be used in our company is React-Native beside the Native code. Technology is the core of a modern business, so that we always try our best to make application for clients to be perfect.', ' ']	['1\nA fun, awesome work environment', '2\n13th & 14th salary', '3\nSocial, health insurance']	['NodeJS', 'ReactJS', 'React Native', 'NodeJS', 'Java', 'Swift']	"['A fun, awesome work environment', 'Progressive and international working environment.', ""Working with big client's, big project and talent colleague & manager"", 'Free coffee everyday', '13th & 14th salary (depending on the Company business)', 'Noel day is holiday', 'Bonus after done project', 'Social insurance, health insurance as the labor law of Viet Nam']"	['Chung cư A3 Phan Xich Long, P7\nPhu Nhuan\nHo Chi Minh']
57	57	Pascalia Asia Vietnam	Pascalia Asia Vietnam - Making a software development/service with thousand of motivation	https://itviec.com/rails/active_storage/representations/proxy/eyJfcmFpbHMiOnsibWVzc2FnZSI6IkJBaHBBN0xkRFE9PSIsImV4cCI6bnVsbCwicHVyIjoiYmxvYl9pZCJ9fQ==--a8491d715349fcb39d187b0c1b47b522c0bd0ec9/eyJfcmFpbHMiOnsibWVzc2FnZSI6IkJBaDdCem9MWm05eWJXRjBTU0lJYW5CbkJqb0dSVlE2RTNKbGMybDZaVjloYm1SZmNHRmtXd2RwUm1sRyIsImV4cCI6bnVsbCwicHVyIjoidmFyaWF0aW9uIn19--e48ed52d99e56a5ff9747052d860ea1b318b2d76/pascalia-asia-vietnam-logo.jpg	51-150	Monday - Friday	Extra salary for OT	Japan	Product		['2nd Phase of Pascalia Asia Vietnam', 'It is great timing you to join us now since we are ready to expand our business in order to achieve our mission in Asia.', 'Pascalia Asia Vietnam', 'is a part of Pascalia Group that has been running over 30 years in Tokyo Japan and 5 years in HCMC Vietnam.', 'Cashback Web Service in Vietnam', 'https://goodeal.com.vn/', '', 'Specialities', '. The project leaders get a total bonus of its project and divided into the members and even yourself', '. 100% independent company(not child company of Pascalia Japan) and share the stocks', '. Spring, Summer bonus, Winter bonus(Spring bonus 2020 is 1B VND for 25 person)', '. Vietnamese holidays + some Japanese holidays', '', '5 Free', 'Trip : 2 times Thailand, 1 time Vietnam, 1 time Malaysia, 2 times Japan', 'Food : Free lunch, dinner for OT, drinks, snacks, parking space at The Holiday(Same place)  ', 'House : Bed space at gorgeous 2 Villas with around 1,000 m2 on Thao Dien, District 2 include big kitchen, swimming pool, jacuzzi and BBQ space', 'Study : 1 on 1 English Lesson, communication in English and IT seminar/training', 'Recreation : MVP award gifts are the Apple products(iPhone11 Pro, Apple Watch, AirPods so on)']	['1\nMission : Altruistic spirit & make everyone happy', '2\nSharing the profit as well as the company stock', '3\nInvesting in a place of learning and growth']	[]	"['We are not only simple offshore development company. ', 'Having an original development process with documentation format and expanding the development phases that is not only coding phase but also upper phase as well as devops our web service for Vietnamese market. Furthermore, we are challenging some AI projects.', 'After you joined us, you will see a lot of opportunities to improve yourself with thousand of motivation that is to share the profit to the employee as much as we can and drive our company by your hands, since we are 100% independent company in Vietnam, then we can discuss and handle all of our company things by ourselves.', ""As a result, we have aiming to contribute for Vietnamese IT industry near future so that our business is planned in the long term. Let's try to improve yourself and make a great future with us. Waiting for your challenge!!!""]"	['Tầng 10, Toàn Nhà Five Star Tower, 28 Bis Mạc Đĩnh Chi, Phường Đa Kao\nDistrict 1\nHo Chi Minh', '17 Nguyen U Di, Thao Dien\nDistrict 2\nHo Chi Minh', 'Da Nang\nOther\nDa Nang', 'PUSH COWORKING SPACE47/384 Lạch Tray, Ngô Quyền, Hải Phòng']
58	58	NashTech	Global software, offshore development and IT company.	https://itviec.com/rails/active_storage/representations/proxy/eyJfcmFpbHMiOnsibWVzc2FnZSI6IkJBaHBBMXgzRXc9PSIsImV4cCI6bnVsbCwicHVyIjoiYmxvYl9pZCJ9fQ==--9747b4e82941b47df75157048a404fc195fd1a40/eyJfcmFpbHMiOnsibWVzc2FnZSI6IkJBaDdCem9MWm05eWJXRjBTU0lJYW5CbkJqb0dSVlE2RTNKbGMybDZaVjloYm1SZmNHRmtXd2RwUm1sRyIsImV4cCI6bnVsbCwicHVyIjoidmFyaWF0aW9uIn19--e48ed52d99e56a5ff9747052d860ea1b318b2d76/logo.jpg	1000+	Monday - Friday	No OT	United Kingdom	Outsourcing		['ABOUT NASHTECH', 'As a brand of Harvey Nash Group, NashTech has committed to deliver the very best talents, IT solutions and Business Process Services to our international clients in the UK, Europe, Asia Pacific & the US.', 'We have over 1,600 software engineers through our development centers in Ho Chi Minh City and Ha Noi, pursuing the highest levels of integrity and quality in providing a unique portfolio of services including:', 'Software Development', 'Business Process Services (BPS)', 'IT Infrastructure & Maintenance', 'Communications Technology R&D', ' ']	['1\n13th Salary + Yearly Performance Bonus', '2\nPremium Health Insurance Package', '3\nIntensive Training Program']	['Java', 'QA QC', '.NET', 'English', 'PHP', 'Business Analyst']	['13 month salary per year', 'Performance bonus (up to 2-month salary)', 'Flexible option bonus for good performers & retention bonus for outstanding performers', 'Social – Health – Insurance paid fully', 'Healthcare: Annual health check-up, Premium Health Insurance (plus 1 slot for your dependent)', 'Annual leaves: 14 ~ 18 days', 'Clubs program: Football, Badminton, Swimming, Tennis, Rock, Yoga…', 'Training courses: Technical skills – Soft skills – English', 'People are extremely important to us and that’s why we have a clear vision: to make NashTech a great place to work in its sector. We pride ourselves on:', 'Professional and Flexible Working Environment', 'Great Teamwork', 'International Assignments', 'WeCare - WeShare - WeDare - WeInnovate Engagement Program']	['364 Cong Hoa\nTan Binh\nHo Chi Minh', '239 Xuan Thuy, Hanoi, Vietnam\nCau Giay\nHa Noi', '29 Yen Bai\nHai Chau\nDa Nang']
