	ids	company	slogan	logo	member	calender	ot	country	typeCompany	agency	overview	why_you_work_here	key_skill	description	address
103	103	Positive Thinking Company (B.O.T)	Positive Thinking Company is a global independent tech consultancy group.	https://itviec.com/rails/active_storage/representations/proxy/eyJfcmFpbHMiOnsibWVzc2FnZSI6IkJBaHBBK08rSXc9PSIsImV4cCI6bnVsbCwicHVyIjoiYmxvYl9pZCJ9fQ==--f7e8841a8d7e4dc15ee5dd5bea5e3112894df970/eyJfcmFpbHMiOnsibWVzc2FnZSI6IkJBaDdCem9MWm05eWJXRjBTU0lJY0c1bkJqb0dSVlE2RTNKbGMybDZaVjloYm1SZmNHRmtXd2RwUm1sRyIsImV4cCI6bnVsbCwicHVyIjoidmFyaWF0aW9uIn19--d55b6722f71e82d147ad94b8445be27797820f9f/PTC-BOT_Tet%20SignOn%20Bonus_Logo%20(1).png	301-500	Monday - Friday	No OT	Belgium	Product		['We are Great Place to Work-Certified™ with 90% of our team members in Vietnam agreeing that we are a great place to work!', 'With a team of more than 3,000 talented tech specialists on the ground in over 35 cities across Europe, the USA, Asia, Australia, and Africa, we serve clients of all sizes. We believe collaboration betters our world. Our unique open ecosystem model allows us to deliver end-to-end tech solutions.', '', 'Our services draw on a wide array of expertise, including apps & platforms, security, cloud, data & analytics, hyperautomation, and digital workplace. ', '', 'We specialize in the B.O.T Build Operate Transfer model for scaling custom software development teams in Vietnam and the APAC region on behalf of our worldwide clients. We set up the infrastructure, provide the engineering resources, and most importantly, share our experience in the local market. ', '', 'Our worldwide clients: YellowPepper, Magnolia, Atlassian, MessageMedia, National Australia Bank, Tripadvisor, 3P Learning, and many more. ', '', 'Follow our channels: ', 'Website: https://positivethinking.tech/', 'LinkedIn: https://bit.ly/3jTzj0m', 'Facebook: https://bit.ly/3ywCDmx', 'Positive Thinking Company – let’s do something great together']	['1\nSustainable growth - no probation', '2\nTet sign-on bonus', '3\nWork with the latest technologies']	['Java', 'ReactJS', '.NET', 'NodeJS', 'PHP', 'AWS']	"['At Positive Thinking Company (B.O.T), we don’t just offer you a job, we offer you your future. Here are our commitments:', 'FUN: We are pretty funny, you will have fun at work.', 'TEAMWORK: You will be collaborating with great people to build great things.', 'TRAVEL: Unlock your world with our global opportunities, we operate on all continents!', 'GUIDANCE: Our internal network of global experts is always ready to support you.', 'VARIETY: You will have access to both consulting and development projects career', 'opportunities.', 'PURPOSE: You will work on key digital initiatives for awesome international clients.', 'STABILITY: We’ve been around since 1999.', 'OPENNESS: We operate in a flat structure and our Senior leadership is always ready to', 'engage.', 'MERIT: You will get recognized and rewarded for your contributions.', 'VISION: We offer a different approach to digital transformation, you should be part of it.', ""SUPPORT: We got your back, we're a family.""]"	['364 Cong Hoa\nTan Binh\nHo Chi Minh']
104	104	Viator, a Tripadvisor company, in partnership with Positive Thinking Company	A market-leading destination tours and activities provider	https://itviec.com/rails/active_storage/representations/proxy/eyJfcmFpbHMiOnsibWVzc2FnZSI6IkJBaHBBK2RrSVE9PSIsImV4cCI6bnVsbCwicHVyIjoiYmxvYl9pZCJ9fQ==--45f3b3c04b9fe212564a35d03daed1a2de12042c/eyJfcmFpbHMiOnsibWVzc2FnZSI6IkJBaDdCem9MWm05eWJXRjBTU0lJY0c1bkJqb0dSVlE2RTNKbGMybDZaVjloYm1SZmNHRmtXd2RwUm1sRyIsImV4cCI6bnVsbCwicHVyIjoidmFyaWF0aW9uIn19--d55b6722f71e82d147ad94b8445be27797820f9f/tripad-logo%20-%20Bui%20Thi%20My%20Dung.png	1-50	Monday - Friday	No OT	Australia	Product		['Viator, a Tripadvisor company, is partnering with Positive Thinking Company to build up a dedicated technology development center based in Ho Chi Minh City, Vietnam. The mission is to deliver solutions used by millions of travelers worldwide! ', 'Viator, a Tripadvisor company, is the market-leading destination for tours and activities provider, featuring thousands of in-destination travel activities in more than 2,000 destinations worldwide. Viator engineers work in a cloud environment of both large, complex enterprise applications and smaller micro-services.', 'For more information, please visit http://www.viator.com/', 'About Positive Thinking Company', 'Positive Thinking Company is a global independent tech consultancy group with a team of more than 3,000 talented tech specialists in over 35 cities across Europe, the USA, Asia, Australia, and Africa with a wide array of expertise, including apps & platforms, security, cloud, data & analytics, hyperautomation, and digital workplace. ', 'We are Great Place to Work-Certified™ with 90% of our team members in Vietnam agreeing that we are a great place to work!']	['1\nSustainable growth - no probation', '2\nCollaborate with great people to build great thing', '3\nWork with the latest technologies']	['Java', 'ReactJS', 'PHP', 'AWS']	['Here at the Viator team, we don’t just offer you a job, we offer you your future. Here’s your chance to get your hands on…', 'Sustainable growth - no probation', 'The latest technologies for product development', 'The finest IT tools to raise your potential to even greater heights', 'The power to deliver truly awesome products', 'Professional training and certification programs', 'English training with a native English teacher', 'Flexible schedules, great benefits and bonuses', 'Private health care program', 'Access to global opportunities']	['Etown 364 Cong Hoa\nTan Binh\nHo Chi Minh']
105	105	Viator, a Tripadvisor company, in partnership with Positive Thinking Company	A market-leading destination tours and activities provider	https://itviec.com/rails/active_storage/representations/proxy/eyJfcmFpbHMiOnsibWVzc2FnZSI6IkJBaHBBK2RrSVE9PSIsImV4cCI6bnVsbCwicHVyIjoiYmxvYl9pZCJ9fQ==--45f3b3c04b9fe212564a35d03daed1a2de12042c/eyJfcmFpbHMiOnsibWVzc2FnZSI6IkJBaDdCem9MWm05eWJXRjBTU0lJY0c1bkJqb0dSVlE2RTNKbGMybDZaVjloYm1SZmNHRmtXd2RwUm1sRyIsImV4cCI6bnVsbCwicHVyIjoidmFyaWF0aW9uIn19--d55b6722f71e82d147ad94b8445be27797820f9f/tripad-logo%20-%20Bui%20Thi%20My%20Dung.png	1-50	Monday - Friday	No OT	Australia	Product		['Viator, a Tripadvisor company, is partnering with Positive Thinking Company to build up a dedicated technology development center based in Ho Chi Minh City, Vietnam. The mission is to deliver solutions used by millions of travelers worldwide! ', 'Viator, a Tripadvisor company, is the market-leading destination for tours and activities provider, featuring thousands of in-destination travel activities in more than 2,000 destinations worldwide. Viator engineers work in a cloud environment of both large, complex enterprise applications and smaller micro-services.', 'For more information, please visit http://www.viator.com/', 'About Positive Thinking Company', 'Positive Thinking Company is a global independent tech consultancy group with a team of more than 3,000 talented tech specialists in over 35 cities across Europe, the USA, Asia, Australia, and Africa with a wide array of expertise, including apps & platforms, security, cloud, data & analytics, hyperautomation, and digital workplace. ', 'We are Great Place to Work-Certified™ with 90% of our team members in Vietnam agreeing that we are a great place to work!']	['1\nSustainable growth - no probation', '2\nCollaborate with great people to build great thing', '3\nWork with the latest technologies']	['Java', 'ReactJS', 'PHP', 'AWS']	['Here at the Viator team, we don’t just offer you a job, we offer you your future. Here’s your chance to get your hands on…', 'Sustainable growth - no probation', 'The latest technologies for product development', 'The finest IT tools to raise your potential to even greater heights', 'The power to deliver truly awesome products', 'Professional training and certification programs', 'English training with a native English teacher', 'Flexible schedules, great benefits and bonuses', 'Private health care program', 'Access to global opportunities']	['Etown 364 Cong Hoa\nTan Binh\nHo Chi Minh']
106	106	Limeade (Tinypulse)	Make Employees Happier	https://itviec.com/rails/active_storage/representations/proxy/eyJfcmFpbHMiOnsibWVzc2FnZSI6IkJBaHBBOW9wSXc9PSIsImV4cCI6bnVsbCwicHVyIjoiYmxvYl9pZCJ9fQ==--2bc4093e5b4c49b269542371101f5a9684fdddf7/eyJfcmFpbHMiOnsibWVzc2FnZSI6IkJBaDdCem9MWm05eWJXRjBTU0lJY0c1bkJqb0dSVlE2RTNKbGMybDZaVjloYm1SZmNHRmtXd2RwUm1sRyIsImV4cCI6bnVsbCwicHVyIjoidmFyaWF0aW9uIn19--d55b6722f71e82d147ad94b8445be27797820f9f/Limeade_logo.png	151-300	Monday - Friday	No OT	United States	Product		"['Limeade is an employee experience software company on a mission to transform work into a source of positivity, energy, humanity, and purpose. Founded in 2006, Limeade is a pioneer in the HR technology industry and is consistently recognized for its own award-winning culture. Our headquarters are in Bellevue, WA. Today, Limeade solutions are used in approximately 100 countries around the globe. We help every employee know their company cares – and deliver people and business results that matter. Limeade partners with its customers to transform the overall employee experience by helping to improve employee well-being, engagement, and sense of inclusion – in addition to reducing the risk of unwanted turnover and burnout.', ""We've got the awards to back it up: Puget Sound Business Journal ranked us #1 Best Workplace in Washington, and Seattle Business ranked us one of the top three Best Companies to Work for in Washington State."", ""We're one of the fastest-growing companies in North America (Deloitte's Technology Fast 500™), and Fortune magazine recognized us as a Best Workplace for Women. ""]"	['1\nStock options; Unlimited annual leave', '2\nSign-in bonus, Cash on Setting office at home', '3\nHybrid workplace, flexible working time']	[]	"['Limeade provides equal employment opportunity (EEO) to all persons regardless of age, color, national origin, citizenship status, physical or mental disability, race, religion, creed, gender, sex, pregnancy, sexual orientation, gender identity and/or expression, genetic information, marital status, status with regard to public assistance, veteran status, or any other characteristic protected by federal, state or local law. In addition, Limeade will provide reasonable accommodations for qualified individuals with disabilities.', 'Benefits & perks', 'A shiny laptop (Macbook/ Window) that fits your need: iPhone, iPad, Android testing devices. ', 'Unlimited vacation policy; work hard and take time when you need it.', 'Stock options: all full-time employees get shares in the company. Along with the rest of us, you will be an owner of the company.', ""Full medical inpatient & outpatient/ dental/ maternity package to fit your and your spouse's' needs."", 'All benefits followed Vietnamese labour law, including 13rd month salary.', 'Employees are showered with snacks & drinks in our bar, mini parties every week, followed with big events every quarter.', 'Training opportunity: continuing development of technical, soft skills, and English through both internal and external classes ', ""So you think you're the SUPER STAR in your field, and this role is perfect for you!!!""]"	['Vincom Center B, 72 Le Thanh Ton street (Floor 18),\nDistrict 1\nHo Chi Minh']
107	107	Hyperion360	We build great software	https://itviec.com/rails/active_storage/representations/proxy/eyJfcmFpbHMiOnsibWVzc2FnZSI6IkJBaHBBN0pURkE9PSIsImV4cCI6bnVsbCwicHVyIjoiYmxvYl9pZCJ9fQ==--f7b415836cf98b096d3300943246e406115002a9/eyJfcmFpbHMiOnsibWVzc2FnZSI6IkJBaDdCem9MWm05eWJXRjBTU0lJYW5CbkJqb0dSVlE2RTNKbGMybDZaVjloYm1SZmNHRmtXd2RwUm1sRyIsImV4cCI6bnVsbCwicHVyIjoidmFyaWF0aW9uIn19--e48ed52d99e56a5ff9747052d860ea1b318b2d76/hyperion360logo.jpg	51-150	Monday - Friday	No OT	Vietnam	Outsourcing		['Hyperion360 is a US-based software development company. We’ve built products used by millions of people and our software development services have helped many companies deliver quality software products on time and within budget. We help clients meet their business goals through a combination of subject-matter experts and agile methodologies that reduce risk and deliver superior results.', 'Join our our global team of expert software developers, designers, and other technical talent and work with cutting edge technologies.']	['1\nFully remote working model', '2\nCutting edges technologies & talented experts', '3\nAttractive salary & benefit']	['JavaScript', 'NodeJS', 'Java', 'AngularJS']	['']	['Tầng 5, 222 Điện Biên Phủ, Phường Võ Thị Sáu, Quận 3, Thành phố Hồ Chí Minh, Việt Nam\nDistrict 3\nHo Chi Minh']
108	108	Titan Technology Corporation	Titan Technology Corporation	https://itviec.com/rails/active_storage/representations/proxy/eyJfcmFpbHMiOnsibWVzc2FnZSI6IkJBaHBBMk9oRmc9PSIsImV4cCI6bnVsbCwicHVyIjoiYmxvYl9pZCJ9fQ==--81a7f3a42024208970726726ac3dd2837cec7441/eyJfcmFpbHMiOnsibWVzc2FnZSI6IkJBaDdCem9MWm05eWJXRjBTU0lJYW5CbkJqb0dSVlE2RTNKbGMybDZaVjloYm1SZmNHRmtXd2RwUm1sRyIsImV4cCI6bnVsbCwicHVyIjoidmFyaWF0aW9uIn19--e48ed52d99e56a5ff9747052d860ea1b318b2d76/Logo_Official.jpg	151-300	Monday - Friday	No OT	Vietnam	Outsourcing		['Titan Technology Corporation is a software outsourcing services company founded in 2013 by a professional team, with a big vision and mission to provide the best services to our clients.', 'We are delivering a leading service for global clients in various categories, committed to the highest level of customer satisfaction, contributing to the nation’s prosperity and providing to our employees with the most favorable working environment, enabling them to express their own color under Titan’s home.', 'We have ability to offer comprehensive knowledge, experience of various domains and industries in software development thank for our proven Engagement Models, help us not only deliver high-quality services but also minimize costs and maximize benefits for our valued clients.', 'With great resource of talent and long-year working experience, we confidence to broaden our client data list to other oversea markets in the upcoming year and become a leading global corporation in providing comprehensive software development.']	['1\nComfortable Working Conditions', '2\nInteresting & Challenging Projects', '3\nCompetitive Salary & Attractive Benefits']	['QA QC', 'ReactJS', '.NET', 'Java', 'PHP', 'DevOps']	['Competitive salary depending on skills and capabilities;', '13th salary plus 14th, 15th, 16th salary based on business performance.', 'Performance review twice a year;', 'Comfortable working conditions and flexible working time;', 'Good career growth opportunities with interesting and challenging projects;', 'English, technical and soft skills training courses;', 'Additional healthcare insurance and annual health check-up;', 'Light beverage and food are available all the time in the office;', 'Outdoor activities with company support: sport clubs, team building, happy hour party, birthday, company trip, staff and family events, etc.']	['40 Lam Son Street, Ward 2\nTan Binh\nHo Chi Minh', '50 Cuu Long Street, Ward 2\nTan Binh\nHo Chi Minh', '9/1/2 Tran Dai Nghia Street, Ward 8, Dalat City, Lam Dong Province']
109	109	Scaleflex	Create ► Manage ► Accelerate !	https://itviec.com/rails/active_storage/representations/proxy/eyJfcmFpbHMiOnsibWVzc2FnZSI6IkJBaHBBMnIySEE9PSIsImV4cCI6bnVsbCwicHVyIjoiYmxvYl9pZCJ9fQ==--00b8a6e1dda664c05a6814a45557a69332c9e07d/eyJfcmFpbHMiOnsibWVzc2FnZSI6IkJBaDdCem9MWm05eWJXRjBTU0lJVUU1SEJqb0dSVlE2RTNKbGMybDZaVjloYm1SZmNHRmtXd2RwUm1sRyIsImV4cCI6bnVsbCwicHVyIjoidmFyaWF0aW9uIn19--d14c81992e54b8fe39b4f22017b9c72f4b5e306b/SCALEFLEX%20LOGO%20VERTICAL%20-%20Hai%20Dang%20Phan.PNG	1-50	Monday - Friday	No OT	France	Product		['Scaleflex is a global B2B SaaS company developing Digital Asset Management and Media Acceleration solutions. Our mission is to load, store, organize, optimize, publish and accelerate all digital assets (images, videos, static files etc.) for web or mobile apps.', 'Scaleflex helps R&D teams, marketers and content managers collaborate better and simplify recurring tasks involved in managing and delivering digital content around the world. Cloudimage and Filerobot have attracted 1300+ customers, from startups to corporations worldwide.', 'As a fast-growing international company, we are now a team of 35 passionate Heroes, spread across France, UK, Germany, Bulgaria, Egypt, Singapore and Vietnam, offering state-of-the-art media processing and asset management services for high traffic websites in various industries including E-Commerce, Real Estate, Online Media and Bank and Finance, with new markets opening every day with Artificial Intelligence, Metadata, CMS Plugins, etc.', 'Self-funded until now, we have established a strong presence with out first product Cloudimage and decided to accelerate our growth in 2020 with the launch of Filerobot, that is receiving a mind-blowing redesign in 2021.']	['1\nInternational team that will help grow your skills', '2\nAttractive benefits + friendly ambiance', '3\nRemote work & flexible hours, we aim for result']	['Python', 'JavaScript', 'PHP', 'PostgreSql', 'DevOps', 'React Native']	"['At Scaleflex, the most important thing is not where you come from but where you want to go, and especially how! Traditional team silos are broken and team members are involved in cross-functional activities to allow everyone to learn as much as possible and identify where he can excel.', 'Strong autonomy, self-discipline and smart organization are essential qualities to perform in an international and remote team. The ideal candidate must be ""hungry but humble"" and work with passion towards achieving common and personal goals.']"	['124-126 Nguyễn Thị Minh Khai, Phường 6, Quận 3, Thành phố Hồ Chí Minh\nDistrict 3\nHo Chi Minh', '42 Ngô Quang Huy, Thảo Điền\nDistrict 2\nHo Chi Minh']
110	110	ONE Tech Stop Vietnam Company Ltd	If you like excitement and challenges, join OTSV, the next destination for your career.	https://itviec.com/rails/active_storage/representations/proxy/eyJfcmFpbHMiOnsibWVzc2FnZSI6IkJBaHBBekZTSFE9PSIsImV4cCI6bnVsbCwicHVyIjoiYmxvYl9pZCJ9fQ==--d2194a721960f39e4a15b1f70e828b74338b2a06/eyJfcmFpbHMiOnsibWVzc2FnZSI6IkJBaDdCem9MWm05eWJXRjBTU0lJY0c1bkJqb0dSVlE2RTNKbGMybDZaVjloYm1SZmNHRmtXd2RwUm1sRyIsImV4cCI6bnVsbCwicHVyIjoidmFyaWF0aW9uIn19--d55b6722f71e82d147ad94b8445be27797820f9f/logo_brand%20(1).png	51-150	Monday - Friday	No OT	Singapore	Product		['ONE Tech Stop Group of Companies is the IT arm of a Global Container Shipping Company, Ocean Network Express Pte Ltd, headquartered in Singapore.', 'ONE Tech Stop Vietnam Company Limited, in Danang, is a newly established subsidiary which specializes in the design and development of IT products for our Head Office through innovative and efficient digital solutions.', 'We use the agile methodology to bring out the best deliverable results in the shortest possible time.  Our objective is to provide the best customer experience to Ocean Network Express and her customers.', 'If you want to be part of a growing company, who is constantly looking for new and better ways to do things, exciting and challenging projects awaits you in OTSV, the next destination for your career.']	['1\nINNOVATIVE, CREATIVE - Think outside of the box', '2\nKEEP CHALLENGING - Never stay in your comfort zone', '3\nCRITICAL THINKING']	[]	['At OTSV, work is a self-fulfilment, we encourage staff to leave their comfort zone, think out of the box, and share their ideas without hesitation. As a team, we analyse and evaluate issues objectively to learn quickly from mistakes.', 'We believe in ‘fail quick, success quick’ and strive to keep pace with the forefront of technology to digitize ONE’s business.', 'The designs of our offices embrace our culture of being flexible and open. Unlike a conventional office we have an open concept with different work areas which encourages collaboration, open-mindedness and spontaneity.', 'Each work area has its own charm and aims to make our staff feel as comfortable in the office as they would feel at home. Have a meet up at the Café amidst the aroma of coffee!']	['Tầng 3-4 tòa nhà Phi Long, 52 Nguyễn Văn Linh\nHai Chau\nDa Nang']
111	111	ONE Tech Stop Vietnam Company Ltd	If you like excitement and challenges, join OTSV, the next destination for your career.	https://itviec.com/rails/active_storage/representations/proxy/eyJfcmFpbHMiOnsibWVzc2FnZSI6IkJBaHBBekZTSFE9PSIsImV4cCI6bnVsbCwicHVyIjoiYmxvYl9pZCJ9fQ==--d2194a721960f39e4a15b1f70e828b74338b2a06/eyJfcmFpbHMiOnsibWVzc2FnZSI6IkJBaDdCem9MWm05eWJXRjBTU0lJY0c1bkJqb0dSVlE2RTNKbGMybDZaVjloYm1SZmNHRmtXd2RwUm1sRyIsImV4cCI6bnVsbCwicHVyIjoidmFyaWF0aW9uIn19--d55b6722f71e82d147ad94b8445be27797820f9f/logo_brand%20(1).png	51-150	Monday - Friday	No OT	Singapore	Product		['ONE Tech Stop Group of Companies is the IT arm of a Global Container Shipping Company, Ocean Network Express Pte Ltd, headquartered in Singapore.', 'ONE Tech Stop Vietnam Company Limited, in Danang, is a newly established subsidiary which specializes in the design and development of IT products for our Head Office through innovative and efficient digital solutions.', 'We use the agile methodology to bring out the best deliverable results in the shortest possible time.  Our objective is to provide the best customer experience to Ocean Network Express and her customers.', 'If you want to be part of a growing company, who is constantly looking for new and better ways to do things, exciting and challenging projects awaits you in OTSV, the next destination for your career.']	['1\nINNOVATIVE, CREATIVE - Think outside of the box', '2\nKEEP CHALLENGING - Never stay in your comfort zone', '3\nCRITICAL THINKING']	[]	['At OTSV, work is a self-fulfilment, we encourage staff to leave their comfort zone, think out of the box, and share their ideas without hesitation. As a team, we analyse and evaluate issues objectively to learn quickly from mistakes.', 'We believe in ‘fail quick, success quick’ and strive to keep pace with the forefront of technology to digitize ONE’s business.', 'The designs of our offices embrace our culture of being flexible and open. Unlike a conventional office we have an open concept with different work areas which encourages collaboration, open-mindedness and spontaneity.', 'Each work area has its own charm and aims to make our staff feel as comfortable in the office as they would feel at home. Have a meet up at the Café amidst the aroma of coffee!']	['Tầng 3-4 tòa nhà Phi Long, 52 Nguyễn Văn Linh\nHai Chau\nDa Nang']
112	112	ONE Tech Stop Vietnam Company Ltd	If you like excitement and challenges, join OTSV, the next destination for your career.	https://itviec.com/rails/active_storage/representations/proxy/eyJfcmFpbHMiOnsibWVzc2FnZSI6IkJBaHBBekZTSFE9PSIsImV4cCI6bnVsbCwicHVyIjoiYmxvYl9pZCJ9fQ==--d2194a721960f39e4a15b1f70e828b74338b2a06/eyJfcmFpbHMiOnsibWVzc2FnZSI6IkJBaDdCem9MWm05eWJXRjBTU0lJY0c1bkJqb0dSVlE2RTNKbGMybDZaVjloYm1SZmNHRmtXd2RwUm1sRyIsImV4cCI6bnVsbCwicHVyIjoidmFyaWF0aW9uIn19--d55b6722f71e82d147ad94b8445be27797820f9f/logo_brand%20(1).png	51-150	Monday - Friday	No OT	Singapore	Product		['ONE Tech Stop Group of Companies is the IT arm of a Global Container Shipping Company, Ocean Network Express Pte Ltd, headquartered in Singapore.', 'ONE Tech Stop Vietnam Company Limited, in Danang, is a newly established subsidiary which specializes in the design and development of IT products for our Head Office through innovative and efficient digital solutions.', 'We use the agile methodology to bring out the best deliverable results in the shortest possible time.  Our objective is to provide the best customer experience to Ocean Network Express and her customers.', 'If you want to be part of a growing company, who is constantly looking for new and better ways to do things, exciting and challenging projects awaits you in OTSV, the next destination for your career.']	['1\nINNOVATIVE, CREATIVE - Think outside of the box', '2\nKEEP CHALLENGING - Never stay in your comfort zone', '3\nCRITICAL THINKING']	[]	['At OTSV, work is a self-fulfilment, we encourage staff to leave their comfort zone, think out of the box, and share their ideas without hesitation. As a team, we analyse and evaluate issues objectively to learn quickly from mistakes.', 'We believe in ‘fail quick, success quick’ and strive to keep pace with the forefront of technology to digitize ONE’s business.', 'The designs of our offices embrace our culture of being flexible and open. Unlike a conventional office we have an open concept with different work areas which encourages collaboration, open-mindedness and spontaneity.', 'Each work area has its own charm and aims to make our staff feel as comfortable in the office as they would feel at home. Have a meet up at the Café amidst the aroma of coffee!']	['Tầng 3-4 tòa nhà Phi Long, 52 Nguyễn Văn Linh\nHai Chau\nDa Nang']
